"Welcome to address book system in mysql database"

-------------------------------------------------
UC1 -> Create a database for address book service
-------------------------------------------------
mysql> create database address_book_service;
Query OK, 1 row affected (0.07 sec)

mysql> show databases;
+----------------------+
| Database             |
+----------------------+
| address_book_service |
| employee_payroll     |
| information_schema   |
| mysql                |
| performance_schema   |
| sakila               |
| sys                  |
| world                |
+----------------------+
8 rows in set (0.00 sec)

--------------------------------------------------------------------------
UC2 -> Create a table with various fields in address book service database
--------------------------------------------------------------------------
mysql> use address_book_service;
Database changed
mysql> create table address_book
    -> (firstName VARCHAR(20) not null,
    -> lastName VARCHAR(20) not null,
    -> address VARCHAR(150) not null,
    -> city VARCHAR(20) not null,
    -> state VARCHAR(20) not null,
    -> zip int not null,
    -> phone_Number int not null,
    -> email_Id VARCHAR(30) not null);
Query OK, 0 rows affected (0.35 sec)

mysql> describe address_book;
+--------------+--------------+------+-----+---------+-------+
| Field        | Type         | Null | Key | Default | Extra |
+--------------+--------------+------+-----+---------+-------+
| firstName    | varchar(20)  | NO   |     | NULL    |       |
| lastName     | varchar(20)  | NO   |     | NULL    |       |
| address      | varchar(150) | NO   |     | NULL    |       |
| city         | varchar(20)  | NO   |     | NULL    |       |
| state        | varchar(20)  | NO   |     | NULL    |       |
| zip          | int          | NO   |     | NULL    |       |
| phone_Number | int          | NO   |     | NULL    |       |
| email_Id     | varchar(30)  | NO   |     | NULL    |       |
+--------------+--------------+------+-----+---------+-------+
8 rows in set (0.00 sec)

---------------------------------------------------------------
UC3 -> Added contacts to table of address book service database
---------------------------------------------------------------
mysql> insert into address_book(firstName,lastName,address,city,state,zip,phone_Number,email_Id)values
    -> ('Swapnil','Patil','New Panvel','Panvel','Maharashtra',410206,92382447,'swapnil123@gmail.com'),
    -> ('Shubham','Ghule','Belapur','New Mumbai','Maharashtra',400614,98467364,'shubham456@gmail.com'),
    -> ('Kunal','Wahule','Kharghar','New Mumbai','Maharashtra',400705,99326474,'kunal789@gmail.com');
Query OK, 3 rows affected (0.09 sec)
Records: 3  Duplicates: 0  Warnings: 0

mysql> select * from address_book;
+-----------+----------+------------+------------+-------------+--------+--------------+----------------------+
| firstName | lastName | address    | city       | state       | zip    | phone_Number | email_Id             |
+-----------+----------+------------+------------+-------------+--------+--------------+----------------------+
| Swapnil   | Patil    | New Panvel | Panvel     | Maharashtra | 410206 |     92382447 | swapnil123@gmail.com |
| Shubham   | Ghule    | Belapur    | New Mumbai | Maharashtra | 400614 |     98467364 | shubham456@gmail.com |
| Kunal     | Wahule   | Kharghar   | New Mumbai | Maharashtra | 400705 |     99326474 | kunal789@gmail.com   |
+-----------+----------+------------+------------+-------------+--------+--------------+----------------------+
3 rows in set (0.00 sec)

---------------------------------------------------------------
UC4 -> Edit contact in a table of address book service database
---------------------------------------------------------------
mysql> update address_book set address = 'Nerul' where firstName = 'Shubham';
Query OK, 1 row affected (0.14 sec)
Rows matched: 1  Changed: 1  Warnings: 0

mysql> select * from address_book;
+-----------+----------+------------+------------+-------------+--------+--------------+----------------------+
| firstName | lastName | address    | city       | state       | zip    | phone_Number | email_Id             |
+-----------+----------+------------+------------+-------------+--------+--------------+----------------------+
| Swapnil   | Patil    | New Panvel | Panvel     | Maharashtra | 410206 |     92382447 | swapnil123@gmail.com |
| Shubham   | Ghule    | Nerul      | New Mumbai | Maharashtra | 400614 |     98467364 | shubham456@gmail.com |
| Kunal     | Wahule   | Kharghar   | New Mumbai | Maharashtra | 400705 |     99326474 | kunal789@gmail.com   |
+-----------+----------+------------+------------+-------------+--------+--------------+----------------------+
3 rows in set (0.00 sec)

-----------------------------------------------------------------
UC5 -> Delete contact in a table of address book service database
-----------------------------------------------------------------
mysql> DELETE FROM address_book WHERE firstName = 'Kunal';
Query OK, 1 row affected (0.06 sec)

mysql> SELECT * FROM address_book;
+-----------+----------+------------+------------+-------------+--------+--------------+----------------------+
| firstName | lastName | address    | city       | state       | zip    | phone_Number | email_Id             |
+-----------+----------+------------+------------+-------------+--------+--------------+----------------------+
| Swapnil   | Patil    | New Panvel | Panvel     | Maharashtra | 410206 |     92382447 | swapnil123@gmail.com |
| Shubham   | Ghule    | Nerul      | New Mumbai | Maharashtra | 400614 |     98467364 | shubham456@gmail.com |
+-----------+----------+------------+------------+-------------+--------+--------------+----------------------+
2 rows in set (0.00 sec)

-----------------------------------------------------------------------------------------
UC6 -> Retrieve contact using city or state from a table of address book service database
-----------------------------------------------------------------------------------------
mysql> SELECT * FROM address_book WHERE city = 'New Mumbai';
+-----------+----------+---------+------------+-------------+--------+--------------+----------------------+
| firstName | lastName | address | city       | state       | zip    | phone_Number | email_Id             |
+-----------+----------+---------+------------+-------------+--------+--------------+----------------------+
| Shubham   | Ghule    | Nerul   | New Mumbai | Maharashtra | 400614 |     98467364 | shubham456@gmail.com |
+-----------+----------+---------+------------+-------------+--------+--------------+----------------------+
1 row in set (0.00 sec)

mysql> SELECT * FROM address_book WHERE city = 'New Mumbai' or state = 'Maharashtra';
+-----------+----------+------------+------------+-------------+--------+--------------+----------------------+
| firstName | lastName | address    | city       | state       | zip    | phone_Number | email_Id             |
+-----------+----------+------------+------------+-------------+--------+--------------+----------------------+
| Swapnil   | Patil    | New Panvel | Panvel     | Maharashtra | 410206 |     92382447 | swapnil123@gmail.com |
| Shubham   | Ghule    | Nerul      | New Mumbai | Maharashtra | 400614 |     98467364 | shubham456@gmail.com |
+-----------+----------+------------+------------+-------------+--------+--------------+----------------------+
2 rows in set (0.00 sec)

---------------------------------------------------------------
UC7 -> Retrieved size of table of address book service database
---------------------------------------------------------------
mysql> SELECT COUNT(city) FROM address_book;
+-------------+
| COUNT(city) |
+-------------+
|           2 |
+-------------+
1 row in set (0.06 sec)

mysql> SELECT COUNT(state) FROM address_book;
+--------------+
| COUNT(state) |
+--------------+
|            2 |
+--------------+
1 row in set (0.00 sec)

mysql> SELECT city,state,COUNT(*) FROM address_book;
+--------+-------------+----------+
| city   | state       | COUNT(*) |
+--------+-------------+----------+
| Panvel | Maharashtra |        2 |
+--------+-------------+----------+
1 row in set (0.01 sec)

mysql> SELECT COUNT(city) and COUNT(state) FROM address_book;
+------------------------------+
| COUNT(city) and COUNT(state) |
+------------------------------+
|                            1 |
+------------------------------+
1 row in set (0.02 sec)

---------------------------------------------------------------------------------------
UC8 -> Retrieve contact sorted alphabetically of table of address book service database
---------------------------------------------------------------------------------------
mysql> select * from address_book;
+-----------+----------+------------+------------+-------------+--------+--------------+----------------------+
| firstName | lastName | address    | city       | state       | zip    | phone_Number | email_Id             |
+-----------+----------+------------+------------+-------------+--------+--------------+----------------------+
| Swapnil   | Patil    | New Panvel | Panvel     | Maharashtra | 410206 |     92382447 | swapnil123@gmail.com |
| Shubham   | Ghule    | Nerul      | New Mumbai | Maharashtra | 400614 |     98467364 | shubham456@gmail.com |
| Kunal     | Wahule   | Kharghar   | New Mumbai | Maharashtra | 400705 |     99326474 | kunal789@gmail.com   |
+-----------+----------+------------+------------+-------------+--------+--------------+----------------------+
3 rows in set (0.00 sec)

mysql> select * from address_book order by firstName;
+-----------+----------+------------+------------+-------------+--------+--------------+----------------------+
| firstName | lastName | address    | city       | state       | zip    | phone_Number | email_Id             |
+-----------+----------+------------+------------+-------------+--------+--------------+----------------------+
| Kunal     | Wahule   | Kharghar   | New Mumbai | Maharashtra | 400705 |     99326474 | kunal789@gmail.com   |
| Shubham   | Ghule    | Nerul      | New Mumbai | Maharashtra | 400614 |     98467364 | shubham456@gmail.com |
| Swapnil   | Patil    | New Panvel | Panvel     | Maharashtra | 410206 |     92382447 | swapnil123@gmail.com |
+-----------+----------+------------+------------+-------------+--------+--------------+----------------------+
3 rows in set (0.04 sec)

----------------------------------------------
UC9 -> Alter address book to add name and type
----------------------------------------------
mysql> alter table address_book add bookName VARCHAR(20) not null ,add contactType VARCHAR(30) not null;
ERROR 1060 (42S21): Duplicate column name 'bookName'
mysql> select * from address_book;
+-----------+----------+------------+------------+-------------+--------+--------------+----------------------+----------+-------------+
| firstName | lastName | address    | city       | state       | zip    | phone_Number | email_Id             | bookName | conatctType |
+-----------+----------+------------+------------+-------------+--------+--------------+----------------------+----------+-------------+
| Swapnil   | Patil    | New Panvel | Panvel     | Maharashtra | 410206 |     92382447 | swapnil123@gmail.com |          |             |
| Shubham   | Ghule    | Nerul      | New Mumbai | Maharashtra | 400614 |     98467364 | shubham456@gmail.com |          |             |
| Kunal     | Wahule   | Kharghar   | New Mumbai | Maharashtra | 400705 |     99326474 | kunal789@gmail.com   |          |             |
+-----------+----------+------------+------------+-------------+--------+--------------+----------------------+----------+-------------+
3 rows in set (0.00 sec)

mysql> describe address_book;
+--------------+--------------+------+-----+---------+-------+
| Field        | Type         | Null | Key | Default | Extra |
+--------------+--------------+------+-----+---------+-------+
| firstName    | varchar(20)  | NO   |     | NULL    |       |
| lastName     | varchar(20)  | NO   |     | NULL    |       |
| address      | varchar(150) | NO   |     | NULL    |       |
| city         | varchar(20)  | NO   |     | NULL    |       |
| state        | varchar(20)  | NO   |     | NULL    |       |
| zip          | int          | NO   |     | NULL    |       |
| phone_Number | int          | NO   |     | NULL    |       |
| email_Id     | varchar(30)  | NO   |     | NULL    |       |
| bookName     | varchar(20)  | NO   |     | NULL    |       |
| conatctType  | varchar(30)  | NO   |     | NULL    |       |
+--------------+--------------+------+-----+---------+-------+
10 rows in set (0.00 sec)

mysql> alter table address_book change contactType contactType VARCHAR(30);
Query OK, 0 rows affected (2.07 sec)
Records: 0  Duplicates: 0  Warnings: 0

mysql> SELECT * FROM address_book;
+-----------+----------+------------+------------+-------------+--------+--------------+----------------------+----------+-------------+
| firstName | lastName | address    | city       | state       | zip    | phone_Number | email_Id             | bookName | contactType |
+-----------+----------+------------+------------+-------------+--------+--------------+----------------------+----------+-------------+
| Swapnil   | Patil    | New Panvel | Panvel     | Maharashtra | 410206 |     92382447 | swapnil123@gmail.com |          |             |
| Shubham   | Ghule    | Nerul      | New Mumbai | Maharashtra | 400614 |     98467364 | shubham456@gmail.com |          |             |
| Kunal     | Wahule   | Kharghar   | New Mumbai | Maharashtra | 400705 |     99326474 | kunal789@gmail.com   |          |             |
+-----------+----------+------------+------------+-------------+--------+--------------+----------------------+----------+-------------+
3 rows in set (0.00 sec)

mysql> UPDATE address_book SET bookName = 'SW',contactType = 'Family' WHERE firstName = 'Swapnil';
Query OK, 1 row affected (0.07 sec)
Rows matched: 1  Changed: 1  Warnings: 0

mysql> UPDATE address_book SET bookName = 'SH',contactType = ' Bussiness' WHERE firstName = 'Shubham';
Query OK, 1 row affected (0.07 sec)
Rows matched: 1  Changed: 1  Warnings: 0

mysql> UPDATE address_book SET bookName = 'KN',contactType = 'Friends' WHERE firstName = 'Kunal';
Query OK, 1 row affected (0.21 sec)
Rows matched: 1  Changed: 1  Warnings: 0

mysql> SELECT * FROM address_book;
+-----------+----------+------------+------------+-------------+--------+--------------+----------------------+----------+-------------+
| firstName | lastName | address    | city       | state       | zip    | phone_Number | email_Id             | bookName | contactType |
+-----------+----------+------------+------------+-------------+--------+--------------+----------------------+----------+-------------+
| Swapnil   | Patil    | New Panvel | Panvel     | Maharashtra | 410206 |     92382447 | swapnil123@gmail.com | SW       | Family      |
| Shubham   | Ghule    | Nerul      | New Mumbai | Maharashtra | 400614 |     98467364 | shubham456@gmail.com | SH       |  Bussiness  |
| Kunal     | Wahule   | Kharghar   | New Mumbai | Maharashtra | 400705 |     99326474 | kunal789@gmail.com   | KN       | Friends     |
+-----------+----------+------------+------------+-------------+--------+--------------+----------------------+----------+-------------+
3 rows in set (0.00 sec)

----------------------------------------------
UC10->Ability to get number of contact persons
----------------------------------------------
mysql> select count(contactType) from address_book where contactType='Family';
+--------------------+
| COUNT(contactType) |
+--------------------+
|                  1 |
+--------------------+
1 row in set (0.00 sec)

mysql> select count(contactType) from address_book WHERE contactType='Friends';
+--------------------+
| COUNT(contactType) |
+--------------------+
|                  1 |
+--------------------+
1 row in set (0.00 sec)

mysql>  SELECT COUNT(contactType) FROM address_book WHERE contactType=' Bussiness';
+--------------------+
| COUNT(contactType) |
+--------------------+
|                  1 |
+--------------------+
1 row in set (0.00 sec)

------------------------------------------------------
UC11->Ability to add person to both Friend and Family
------------------------------------------------------
mysql> insert into address_book
    -> (firstName,lastName,address,city,state,zip,phone_number,email_Id,bookName,contactType)VALUES
    -> ('Yogesh','Kashid','New Panvel','Mumbai','Maharashtra',410206,234478,'yogesh123@gmail.com','YK','Friend');
Query OK, 1 row affected (0.07 sec)

mysql> insert into address_book
    -> (firstName,lastName,address,city,state,zip,phone_number,email_Id,bookName,contactType)VALUES
    -> ('Avinash','Patil','Nerul','Mumbai','Maharashtra',400614,866586,'avinash098@gmail.com','AP','Family');
Query OK, 1 row affected (0.09 sec)

mysql> select * from address_book;
+-----------+----------+------------+------------+-------------+--------+--------------+----------------------+----------+-------------+
| firstName | lastName | address    | city       | state       | zip    | phone_Number | email_Id             | bookName | contactType |
+-----------+----------+------------+------------+-------------+--------+--------------+----------------------+----------+-------------+
| Swapnil   | Patil    | New Panvel | Panvel     | Maharashtra | 410206 |     92382447 | swapnil123@gmail.com | SW       | Family      |
| Shubham   | Ghule    | Nerul      | New Mumbai | Maharashtra | 400614 |     98467364 | shubham456@gmail.com | SH       | Bussiness   |
| Kunal     | Wahule   | Kharghar   | New Mumbai | Maharashtra | 400705 |     99326474 | kunal789@gmail.com   | KN       | Friends     |
| Yogesh    | Kashid   | New Panvel | Mumbai     | Maharashtra | 410206 |       234478 | yogesh123@gmail.com  | YK       | Friend      |
| Avinash   | Patil    | Nerul      | Mumbai     | Maharashtra | 400614 |       866586 | avinash098@gmail.com | AP       | Family      |
+-----------+----------+------------+------------+-------------+--------+--------------+----------------------+----------+-------------+
5 rows in set (0.00 sec)


